[
  {
    "id": "core_environment_abandoned_grove",
    "name": { "en-US": "Abandoned Grove" },
    "tier": 1,
    "type": "EXPLORATION",
    "description": [
      {
        "paragraph": {
          "en-US": "A former druidic grove lying fallow and fully reclaimed by nature."
        }
      }
    ],
    "impulses": { "en-US": "Draw in the curious, echo the past" },
    "difficulty": 11,
    "features": [
      {
        "name": { "en-US": "Overgrown Battlefield - Passive" },
        "description": [
          {
            "paragraph": {
              "en-US": "There has been a battle here. A PC can make an Instinct Roll to identify evidence of that fight. On a success with Hope, learn all three pieces of information below. On a success with Fear, learn two. On a failure, a PC can mark a Stress to learn one and gain advantage on the next action roll to investigate this environment. A PC with an appropriate background or Experience can learn an additional detail and ask a follow-up question about the scene and get a truthful (if not always complete) answer."
            }
          },
          {
            "list": [
              {
                "en-US": "Traces of a battle (broken weapons and branches, gouges in the ground) litter the ground."
              },
              {
                "en-US": "A moss-covered tree trunk is actually the corpse of a treant."
              },
              {
                "en-US": "Still-standing trees are twisted in strange ways, as if by powerful magic."
              }
            ]
          }
        ]
      },
      {
        "name": { "en-US": "Barbed Vines - Action" },
        "description": [
          {
            "paragraph": {
              "en-US": "Pick a point within the grove. All targets within Very Close range of that point must succeed on an Agility Reaction Roll or take <bold>1d8+3</bold> physical damage and become <italic>Restrained</italic> by barbed vines. <italic>Restrained</italic> lasts until they're freed with a successful Finesse or Strength roll or by dealing at least 6 damage to the vines."
            }
          }
        ]
      },
      {
        "name": { "en-US": "You Are Not Welcome Here - Action" },
        "description": [
          {
            "paragraph": {
              "en-US": "A Young Dryad, two Sylvan Soldiers, and a number of Minor Treants equal to the number of PCs appear to confront the party for their intrusion."
            }
          }
        ]
      },
      {
        "name": { "en-US": "Defiler - Action" },
        "description": [
          {
            "paragraph": {
              "en-US": "<bold>Spend a Fear</bold> to summon a Minor Chaos Elemental drawn to the echoes of violence and discord. They appear within Far range of a chosen PC and immediately take the spotlight."
            }
          }
        ]
      }
    ]
  },
  {
    "id": "core_environment_ambushed",
    "name": { "en-US": "Ambushed" },
    "tier": 1,
    "type": "EVENT",
    "description": [
      {
        "paragraph": {
          "en-US": "An ambush is set to catch an unsuspecting party off-guard."
        }
      }
    ],
    "impulses": { "en-US": "Overwhelm, scatter, surround" },
    "features": [
      {
        "name": { "en-US": "Relative Strength - Passive" },
        "description": [
          {
            "paragraph": {
              "en-US": "The Difficulty of this environment equals that of the adversary with the highest Difficulty."
            }
          }
        ]
      },
      {
        "name": { "en-US": "Surprise! - Action" },
        "description": [
          {
            "paragraph": {
              "en-US": "The ambushers reveal themselves to the party, you gain 2 Fear, and the spotlight immediately shifts to one of the ambushing adversaries."
            }
          }
        ]
      }
    ]
  },
  {
    "id": "core_environment_ambushers",
    "name": { "en-US": "Ambushers" },
    "tier": 1,
    "type": "EVENT",
    "description": [
      {
        "paragraph": {
          "en-US": "An ambush is set by the PCs to catch unsuspecting adversaries off-guard."
        }
      }
    ],
    "impulses": { "en-US": "Escape, group up, protect the most vulnerable" },
    "features": [
      {
        "name": { "en-US": "Relative Strength - Passive" },
        "description": [
          {
            "paragraph": {
              "en-US": "The Difficulty of this environment equals that of the adversary with the highest Difficulty."
            }
          }
        ]
      },
      {
        "name": { "en-US": "Where Did They Come From? - Reaction" },
        "description": [
          {
            "paragraph": {
              "en-US": "When a PC starts the ambush on unsuspecting adversaries, you lose 2 Fear and the first attack roll a PC makes has advantage."
            }
          }
        ]
      }
    ]
  },
  {
    "id": "core_environment_bustling_marketplace",
    "name": { "en-US": "Bustling Marketplace" },
    "tier": 1,
    "type": "SOCIAL",
    "description": [
      {
        "paragraph": {
          "en-US": "The economic heart of the settlement, with local artisans, traveling merchants, and patrons across social classes."
        }
      }
    ],
    "impulses": {
      "en-US": "Buy low, and sell high, tempt and tantalize with wares from near and far"
    },
    "difficulty": 10,
    "features": [
      {
        "name": { "en-US": "Tip the Scales - Passive" },
        "description": [
          {
            "paragraph": {
              "en-US": "PCs can gain advantage on a Presence Roll by offering a handful of gold as part of the interaction."
            }
          }
        ]
      },
      {
        "name": { "en-US": "Unexpected Find - Action" },
        "description": [
          {
            "paragraph": {
              "en-US": "Reveal to the PCs that one of the merchants has something they want or need, such as food from their home, a rare book, magical components, a dubious treasure map, or a magical key."
            }
          }
        ]
      },
      {
        "name": { "en-US": "Sticky Fingers - Action" },
        "description": [
          {
            "paragraph": {
              "en-US": "A thief tries to steal something from a PC. The PC must succeed on an Instinct Roll to notice the thief or lose an item of the GM's choice as the thief escapes to a Close distance. To retrieve the stolen item, the PCs must complete a Progress Countdown (<bold>6</bold>) to chase down the thief before the thief completes a Consequence Countdown (<bold>4</bold>) and escapes to their hideout."
            }
          }
        ]
      },
      {
        "name": { "en-US": "Crowd Closes In - Reaction" },
        "description": [
          {
            "paragraph": {
              "en-US": "When one of the PCs splits from the group, the crowds shift and cut them off from the party."
            }
          }
        ]
      }
    ]
  },
  {
    "id": "core_environment_cliffside_ascent",
    "name": { "en-US": "Cliffside Ascent" },
    "tier": 1,
    "type": "TRAVERSAL",
    "description": [
      {
        "paragraph": {
          "en-US": "A steep, rocky cliffside tall enough to make traversal dangerous."
        }
      }
    ],
    "impulses": {
      "en-US": "Cast the unready down to a rocky doom, draw people in with promise of what lies at the top"
    },
    "difficulty": 12,
    "features": [
      {
        "name": { "en-US": "The Climb - Passive" },
        "description": [
          {
            "paragraph": {
              "en-US": "Climbing up the cliffside uses a Progress Countdown (<bold>12</bold>). It ticks down according to the following criteria when the PCs make an action roll to climb:"
            }
          },
          {
            "list": [
              { "en-US": "Critical Success: Tick down 3" },
              { "en-US": "Success with Hope: Tick down 2" },
              { "en-US": "Success with Fear: Tick down 1" },
              { "en-US": "Failure with Hope: No advancement" },
              { "en-US": "Failure with Fear: Tick up 1" }
            ]
          },
          {
            "paragraph": {
              "en-US": "When the countdown triggers, the party has made it to the top of the cliff."
            }
          }
        ]
      },
      {
        "name": { "en-US": "Pitons Left Behind - Passive" },
        "description": [
          {
            "paragraph": {
              "en-US": "Previous climbers left behind large metal rods that climbers can use to aid their ascent. If a PC using the pitons fails an action roll to climb, they can mark a Stress instead of ticking the countdown up."
            }
          }
        ]
      },
      {
        "name": { "en-US": "Fall - Action" },
        "description": [
          {
            "paragraph": {
              "en-US": "<bold>Spend a Fear</bold> to have a PC's handhold fail, plummeting them toward the ground. If they aren't saved on the next action, they hit the ground and tick up the countdown by 2. The PC takes <bold>1d12</bold> physical damage if the countdown is between 8 and 12, <bold>2d12</bold> between 4 and 7, and <bold>3d12</bold> at 3 or lower."
            }
          }
        ]
      }
    ]
  },
  {
    "id": "core_environment_local_tavern",
    "name": { "en-US": "Local Tavern" },
    "tier": 1,
    "type": "SOCIAL",
    "description": [
      {
        "paragraph": {
          "en-US": "A lively tavern that serves as the social hub for its town."
        }
      }
    ],
    "impulses": {
      "en-US": "Provide opportunities for adventurers, nurture community"
    },
    "difficulty": 10,
    "features": [
      {
        "name": { "en-US": "What's the Talk of the Town? - Passive" },
        "description": [
          {
            "paragraph": {